{
  "apiVersion": "powerfarm.specs/v0",
  "kind": "DirectionDecision",
  "responsibility": {
    "id": "powerfarm.app/contract/exec.build-powerfarm",
    "generation": 1
  },
  "raisedAt": "2026-09-16T10:00:00Z",
  "reviewAt": "2026-09-16T10:05:00Z",
  "whatHappened": "Every admitted intelligence route for powerfarm.app/contract/exec.build-powerfarm was refused for credential, quota or budget reasons.",
  "consequence": "No work was performed this turn. The dataset and state are unchanged, and the responsibility is contained until 2026-09-16T10:05:00Z.",
  "attemptedRecovery": [
    "primary: failed: intelligence route unavailable: credential, quota or budget refused: occupant-chat",
    "diagnosis: the route was refused for credential, quota or budget reasons; retrying the same route cannot help",
    "alternate: failed: intelligence route unavailable: credential, quota or budget refused: occupant-chat"
  ],
  "exactDecision": "Restore the credential or budget of one admitted route, or authorize another route within the existing budget. Without a decision the responsibility stays contained and is re-evaluated at 2026-09-16T10:05:00Z.",
  "boundary": "unavailable-human-controlled-credential"
}
